{
  "$schema": "https://everythingx.dev/schema/edge-weight.schema.json",
  "schema_version": "0.1.0",
  "meaning": "Environment-bound empirical graph-edge load for this standalone Capsule; semantic loss and hard constraints are evaluated separately.",
  "capsule": {
    "id": "capsule:pam-to-ppm",
    "version": "0.1.0",
    "repository_path": "capsules/image/raster/direct/pam-to-ppm"
  },
  "profile": {
    "profile_id": "exbench:ci-default-v1",
    "generated_at": "2026-07-29T10:09:59.520096+00:00",
    "source_report": "registry/performance/baseline.json",
    "scope": "End-to-end Kernel default invocation including Adapter buffering and Capsule execution.",
    "comparability": "Scores are comparable only when profile_id, harness_sha256 and environment class match.",
    "harness_sha256": "f0e48382425346ac776e3929594face64d74bd76c409cc9001d567c96a311a00",
    "environment_fingerprint_sha256": "521a569e3c6b78dafc47fa5fe3321448120a89e8049d5521402fdc6ce7ce88b3",
    "environment_class": {
      "os": "Linux-6.17.0-1020-azure-x86_64-with-glibc2.39",
      "architecture": "x86_64",
      "rustc": "rustc 1.97.1 (8bab26f4f 2026-07-14)",
      "github_runner_image": "ubuntu24"
    },
    "evidence_commit_sha": "11113269e9421dc4d70fa290a23d6c7278c8ffb6",
    "evidence_run_id": "30442170546"
  },
  "planner_contract": {
    "kind": "environment-bound-empirical-vector",
    "input_variable": "N = input byte length",
    "selection_order": [
      "semantic and resource hard constraints",
      "raw edge-weight vector at the concrete input size",
      "derived load only for same-profile equivalent-edge tie-breaking"
    ],
    "path_composition": {
      "latency": "sum sequential edge estimates",
      "peak_memory": "maximum live-set estimate; never blindly sum edge peaks",
      "output_bytes": "feed each edge estimate into the next edge input"
    }
  },
  "capabilities": [
    {
      "capability_id": "capability:pam-to-ppm/rgba8-code-value-exact/native-portable",
      "strategy": "rgba8-code-value-exact",
      "backend": "native-portable",
      "inputs": [
        "exfmt:image:pam"
      ],
      "outputs": [
        "exfmt:image:ppm"
      ],
      "edge_weight": {
        "kind": "empirical-multidimensional",
        "fixed_latency_micros": 4.108562,
        "nanoseconds_per_input_byte": 3.976065952,
        "peak_memory_bytes_per_input_byte": 4.333290525,
        "output_bytes_per_input_byte": 0.999984742,
        "estimated_latency_micros": "fixed_latency_micros + nanoseconds_per_input_byte * N / 1000",
        "estimated_peak_memory_bytes": "peak_memory_bytes_per_input_byte * N",
        "estimated_output_bytes": "output_bytes_per_input_byte * N",
        "performance_score_0_to_100": 21.844,
        "load_0_to_100": 78.156,
        "load_direction": "higher-is-more-expensive"
      },
      "observations": {
        "small": {
          "input_bytes": 12349,
          "output_bytes": 12301,
          "p50_micros": 53.209,
          "p95_micros": 64.5
        },
        "large": {
          "input_bytes": 3145793,
          "output_bytes": 3145745,
          "p50_micros": 12511.989,
          "p95_micros": 12757.186,
          "throughput_mib_s": 239.775,
          "reported_peak_memory_bytes": 13631635
        }
      },
      "source_evidence": "registry/performance/baseline.json#capability:pam-to-ppm/rgba8-code-value-exact/native-portable"
    }
  ]
}
